{
  "schema_version": "1.0",
  "plan_id": "G2MATERIAL-DISTINCT-20260820-01",
  "status": "prepared_no_network",
  "method": "official_publication_manifest_route",
  "target_candidate_count": 96,
  "source_register": {
    "path": "data/seed/source_register.csv",
    "sha256": "16023b6b560c141bb81be13b23f061481aa5b598ead7a24db4cff1f327c9fa4e"
  },
  "exposure_ledger": {
    "path": "data/methods/g2/G2HOLDOUT-METADATA-EXPANSION-20260816-03/design/ledger.json",
    "sha256": "e43628df4592ab3386ad811d0871532d2fe40e6af7f169455994447572b8242d"
  },
  "owner_decision": {
    "path": "docs/governance/g2-material-distinct-option-a-owner-decision-2026-08-20.md",
    "sha256": "1be90c4b2e376e09c34b6ea08aceed47308ed6965b9303508d6b51415779fe00"
  },
  "complete_predecessor_chain": [
    {
      "path": "data/methods/g2/G2HOLDOUT-STRUCTURAL-PREFLIGHT-20260815-01/url-resolution/exposure-ledger.json",
      "sha256": "1cd2ce0fc633b43e5ebf95635c5518e0dd974192378121d49b25d7d9bb29b9b3"
    },
    {
      "path": "data/methods/g2/G2HOLDOUT-PROSPECTIVE-20260815-01/intake/exposure-ledger.json",
      "sha256": "44cb2c2671000751daa340eceabac9ccfe452132a4c91e3e393e3740aaef0492"
    }
  ],
  "controls": {
    "complete_exposure_chain_required": true,
    "candidate_url_must_not_overlap": true,
    "network_access_authorized": false,
    "url_access_authorized": false,
    "source_content_accessed": false,
    "extraction_authorized": false,
    "rights_acceptance_authorized": false,
    "publication_authorized": false,
    "release_authorized": false,
    "g2_passage_authorized": false
  },
  "stopping_rules": [
    "any digest-bound exposure-chain failure",
    "any candidate URL overlap with cumulative exposure",
    "fewer than 96 repository-metadata candidates",
    "any external request or source-content access"
  ],
  "resource_estimate": {
    "repository_metadata_rows": 20,
    "network_requests": 0,
    "source_content_accesses": 0,
    "external_contacts": 0
  }
}
